{
  "schemaVersion": "1.0",
  "suiteId": "algorithm-debug-quality-50",
  "description": "Fifty real OpenCode sessions covering target boundaries, runtime evidence, causal refinement, integrity, and direct answers",
  "cases": [
    {
      "id": "passing-01",
      "question": "Run this algorithm UT, classify its process and test outcome, and confirm whether its newly generated Gantt JSON was archived.",
      "targetTest": {
        "className": "org.example.scheduler.wafer.WaferSchedulingReproductionTest",
        "methodName": "reproduceComplexSchedulingFromTimestampedInput"
      },
      "requiredTools": [
        "analysis_begin",
        "algorithm_input_capture",
        "run_test",
        "case_audit"
      ],
      "forbiddenTools": [
        "analysis_complete"
      ],
      "expectedProcessOutcome": "SUCCEEDED",
      "expectedTestOutcome": "PASSED",
      "requiredAnswerPatterns": [
        "passed|success"
      ],
      "forbiddenAnswerPatterns": [],
      "requireEvidenceReferences": true,
      "allowCodePath": false,
      "allowJdwp": false,
      "maxTargetTestExecutions": 1,
      "expectedGanttOutcome": "PRESENT",
      "requireAnswerContext": true
    },
    {
      "id": "passing-02",
      "question": "Execute the parallel-strategy UT and report the verified Run outcome and Gantt archival result without dynamic collection.",
      "targetTest": {
        "className": "org.example.scheduler.wafer.WaferSchedulingStrategyScenariosTest",
        "methodName": "parallelModeOrdersSameWaferOrdinalAcrossJobs"
      },
      "requiredTools": [
        "analysis_begin",
        "algorithm_input_capture",
        "run_test",
        "case_audit"
      ],
      "forbiddenTools": [
        "analysis_complete"
      ],
      "expectedProcessOutcome": "SUCCEEDED",
      "expectedTestOutcome": "PASSED",
      "requiredAnswerPatterns": [
        "passed|success"
      ],
      "forbiddenAnswerPatterns": [],
      "requireEvidenceReferences": true,
      "allowCodePath": false,
      "allowJdwp": false,
      "maxTargetTestExecutions": 1,
      "expectedGanttOutcome": "PRESENT",
      "requireAnswerContext": true
    },
    {
      "id": "passing-03",
      "question": "Execute the serial-strategy UT and distinguish Maven process success, JUnit success, and Gantt presence.",
      "targetTest": {
        "className": "org.example.scheduler.wafer.WaferSchedulingStrategyScenariosTest",
        "methodName": "serialModeCompletesEarlierJobWafersFirst"
      },
      "requiredTools": [
        "analysis_begin",
        "algorithm_input_capture",
        "run_test",
        "case_audit"
      ],
      "forbiddenTools": [
        "analysis_complete"
      ],
      "expectedProcessOutcome": "SUCCEEDED",
      "expectedTestOutcome": "PASSED",
      "requiredAnswerPatterns": [
        "passed|success"
      ],
      "forbiddenAnswerPatterns": [],
      "requireEvidenceReferences": true,
      "allowCodePath": false,
      "allowJdwp": false,
      "maxTargetTestExecutions": 1,
      "expectedGanttOutcome": "PRESENT",
      "requireAnswerContext": true
    },
    {
      "id": "passing-04",
      "question": "Run the running-wafer strategy UT and report whether it passed and produced one new Gantt JSON.",
      "targetTest": {
        "className": "org.example.scheduler.wafer.WaferSchedulingStrategyScenariosTest",
        "methodName": "runningWaferIsScheduledBeforeWaitingWafers"
      },
      "requiredTools": [
        "analysis_begin",
        "algorithm_input_capture",
        "run_test",
        "case_audit"
      ],
      "forbiddenTools": [
        "analysis_complete"
      ],
      "expectedProcessOutcome": "SUCCEEDED",
      "expectedTestOutcome": "PASSED",
      "requiredAnswerPatterns": [
        "passed|success"
      ],
      "forbiddenAnswerPatterns": [],
      "requireEvidenceReferences": true,
      "allowCodePath": false,
      "allowJdwp": false,
      "maxTargetTestExecutions": 1,
      "expectedGanttOutcome": "PRESENT",
      "requireAnswerContext": true
    },
    {
      "id": "passing-05",
      "question": "Verify the target reproduction UT succeeds, cite its Run evidence, and state whether any CodePath or JDWP collection was unnecessary.",
      "targetTest": {
        "className": "org.example.scheduler.wafer.WaferSchedulingReproductionTest",
        "methodName": "reproduceComplexSchedulingFromTimestampedInput"
      },
      "requiredTools": [
        "analysis_begin",
        "algorithm_input_capture",
        "run_test",
        "case_audit"
      ],
      "forbiddenTools": [
        "analysis_complete"
      ],
      "expectedProcessOutcome": "SUCCEEDED",
      "expectedTestOutcome": "PASSED",
      "requiredAnswerPatterns": [
        "passed|success"
      ],
      "forbiddenAnswerPatterns": [],
      "requireEvidenceReferences": true,
      "allowCodePath": false,
      "allowJdwp": false,
      "maxTargetTestExecutions": 1,
      "expectedGanttOutcome": "PRESENT",
      "requireAnswerContext": true
    },
    {
      "id": "missing-ut-01",
      "question": "Check this named UT. If it does not exist, report the missing target and stop before any target execution.",
      "targetTest": {
        "className": "org.example.scheduler.wafer.DoesNotExistTest",
        "methodName": "missingTarget"
      },
      "requiredTools": [
        "analysis_begin",
        "algorithm_input_capture",
        "case_audit"
      ],
      "forbiddenTools": [
        "codepath_plan_create",
        "codepath_collect",
        "jdwp_plan_create",
        "jdwp_collect",
        "analysis_complete"
      ],
      "requiredAnswerPatterns": [
        "does not exist|not found|not confirmed to exist"
      ],
      "forbiddenAnswerPatterns": [
        "root cause.*algorithm"
      ],
      "requireEvidenceReferences": false,
      "allowCodePath": false,
      "allowJdwp": false,
      "maxTargetTestExecutions": 0,
      "requireAnswerContext": true
    },
    {
      "id": "missing-ut-02",
      "question": "Confirm whether this requested method exists in the named test class; do not substitute another method.",
      "targetTest": {
        "className": "org.example.scheduler.wafer.WaferSchedulingReproductionTest",
        "methodName": "methodThatDoesNotExist"
      },
      "requiredTools": [
        "analysis_begin",
        "algorithm_input_capture",
        "case_audit"
      ],
      "forbiddenTools": [
        "codepath_plan_create",
        "codepath_collect",
        "jdwp_plan_create",
        "jdwp_collect",
        "analysis_complete"
      ],
      "requiredAnswerPatterns": [
        "does not exist|not found|not confirmed to exist"
      ],
      "forbiddenAnswerPatterns": [
        "root cause.*algorithm"
      ],
      "requireEvidenceReferences": false,
      "allowCodePath": false,
      "allowJdwp": false,
      "maxTargetTestExecutions": 0,
      "requireAnswerContext": true
    },
    {
      "id": "missing-ut-03",
      "question": "Validate the exact target identity and stop with a missing-UT conclusion when the class is absent.",
      "targetTest": {
        "className": "org.example.scheduler.wafer.UnknownSchedulingTest",
        "methodName": "reproduce"
      },
      "requiredTools": [
        "analysis_begin",
        "algorithm_input_capture",
        "case_audit"
      ],
      "forbiddenTools": [
        "codepath_plan_create",
        "codepath_collect",
        "jdwp_plan_create",
        "jdwp_collect",
        "analysis_complete"
      ],
      "requiredAnswerPatterns": [
        "does not exist|not found|not confirmed to exist"
      ],
      "forbiddenAnswerPatterns": [
        "root cause.*algorithm"
      ],
      "requireEvidenceReferences": false,
      "allowCodePath": false,
      "allowJdwp": false,
      "maxTargetTestExecutions": 0,
      "requireAnswerContext": true
    },
    {
      "id": "missing-ut-04",
      "question": "Check this strategy UT name exactly and do not run or collect against a similarly named test.",
      "targetTest": {
        "className": "org.example.scheduler.wafer.WaferSchedulingStrategyScenariosTest",
        "methodName": "unknownStrategy"
      },
      "requiredTools": [
        "analysis_begin",
        "algorithm_input_capture",
        "case_audit"
      ],
      "forbiddenTools": [
        "codepath_plan_create",
        "codepath_collect",
        "jdwp_plan_create",
        "jdwp_collect",
        "analysis_complete"
      ],
      "requiredAnswerPatterns": [
        "does not exist|not found|not confirmed to exist"
      ],
      "forbiddenAnswerPatterns": [
        "root cause.*algorithm"
      ],
      "requireEvidenceReferences": false,
      "allowCodePath": false,
      "allowJdwp": false,
      "maxTargetTestExecutions": 0,
      "requireAnswerContext": true
    },
    {
      "id": "missing-ut-05",
      "question": "Determine whether the specified fully qualified UT exists and report only the confirmed boundary.",
      "targetTest": {
        "className": "missing.package.AlgorithmTest",
        "methodName": "caseOne"
      },
      "requiredTools": [
        "analysis_begin",
        "algorithm_input_capture",
        "case_audit"
      ],
      "forbiddenTools": [
        "codepath_plan_create",
        "codepath_collect",
        "jdwp_plan_create",
        "jdwp_collect",
        "analysis_complete"
      ],
      "requiredAnswerPatterns": [
        "does not exist|not found|not confirmed to exist"
      ],
      "forbiddenAnswerPatterns": [
        "root cause.*algorithm"
      ],
      "requireEvidenceReferences": false,
      "allowCodePath": false,
      "allowJdwp": false,
      "maxTargetTestExecutions": 0,
      "requireAnswerContext": true
    },
    {
      "id": "input-boundary-01",
      "question": "Inspect the target UT first-level String input literal and stop because its one supported algorithm input file is missing.",
      "targetTest": {